{
  "version": 2,
  "status": "human_reviewed",
  "unit_of_evaluation": "one reported detection requirement",
  "evidence_semantics": "Every required group must be recalled (AND across groups); one exact chunk locator inside a group is sufficient (OR within a group). Supporting evidence and deterministic_context_evidence are excluded from retrieval gold; deterministic context is attached after the primary evidence is selected.",
  "evaluation_profiles": {
    "lenient_relevance": {
      "metric": "any_relevant_chunk_recall_at_k",
      "evidence_field": "relevant_evidence",
      "primary": false,
      "description": "Any direct or supporting chunk is a hit; use for candidate-generation diagnosis only."
    },
    "strict_answer": {
      "metric": "all_required_evidence_groups_recall_at_k",
      "evidence_field": "required_evidence_groups",
      "primary": true,
      "description": "All AND-required groups must be recalled; OR alternatives inside each group are equivalent."
    }
  },
  "source_artifacts": {
    "migration_note": "Migrated from v1 candidate review. The v1 working sets were intentionally removed after migration; this draft is now the sole editable ground-truth source."
  },
  "summary": {
    "case_count": 40,
    "retrieval_answerable_candidates": 33,
    "context_required_cases": 3,
    "deterministic_prefilter_cases": 4,
    "required_evidence_groups": 36,
    "deterministic_context_groups": 4,
    "evidence_locator_assignments": 51,
    "unique_evidence_chunks": 14,
    "deterministic_context_locator_assignments": 4,
    "unique_deterministic_context_chunks": 2,
    "relevant_locator_assignments": 115,
    "unique_relevant_chunks": 38,
    "pending_domain_review_cases": 0,
    "scoreable_case_count": 33,
    "legacy_direct_missing_conflicts": 0,
    "resolved_legacy_direct_missing_conflicts": 15
  },
  "cases": [
    {
      "case_id": "hbjc-4-r1",
      "dataset_split": "development",
      "retrieval_class": "numeric_parameter_table",
      "detection_project": {
        "project_name": "空载损耗和空载电流测量",
        "reported_requirement": {
          "text": "空载损耗P0(kW):≤0.370",
          "unit": "kW"
        },
        "sample_context": {
          "sample_name": "油浸式变压器",
          "model": "S20-M.RL-400/10-NX2",
          "rated_capacity": "400 kVA",
          "rated_voltage": "10/0.4 kV"
        }
      },
      "evaluation_scope": "retrieval",
      "answerability_status": "answerable_candidate",
      "missing_context_fields": [],
      "relevant_evidence": [
        {
          "locator": {
            "standard_no": "GB 20052-2024",
            "content_type": "section",
            "page_start": 3,
            "page_end": 3,
            "text_sha256": "94dece7e1eadd4d46b37c4bee015f07b8f70dd3cc18725be8b67addc285b7d24",
            "section": "1",
            "section_title": "范围"
          },
          "evidence_quote": "本文件适用于三相 10 kV 电压等级、无励磁调压、额定频率为 50 Hz、额定容量为 30 kVA～2 500 kVA 的油浸式配电变压器和干式配电变压器",
          "quote_verified": true,
          "reason": "该条款明确界定了标准适用范围，确认样品（10kV, 400kVA, 油浸式）属于GB 20052-2024管辖对象，是判定后续限值有效性的必要前提。",
          "legacy_label": "supporting_candidate",
          "discovery_method": "candidate_review"
        },
        {
          "locator": {
            "standard_no": "GB 20052-2024",
            "content_type": "section",
            "page_start": 4,
            "page_end": 4,
            "text_sha256": "09dc63bef8ea33caad37ed0129c552bad8148ab1506c8065313160c4feed748f",
            "section": "5.2",
            "section_title": "变压器能效限定值"
          },
          "evidence_quote": "a) 10 kV 配电变压器空载损耗和负载损耗限值均应不高于表 1 和表 2 的规定",
          "quote_verified": true,
          "reason": "该条款建立了从通用要求到具体数据表（表1和表2）的引用关系，指明10kV配电变压器的空载损耗限值应参照表1，逻辑链条完整且必要。",
          "legacy_label": "supporting_candidate",
          "discovery_method": "candidate_review"
        },
        {
          "locator": {
            "standard_no": "GB 20052-2024",
            "content_type": "table",
            "page_start": 5,
            "page_end": 5,
            "text_sha256": "9c986dc1c0006eaf9bb304e9b75b58444fb63496818cb6dac2eef0b96ba572dc",
            "table_no": "1",
            "table_title": "10 kV 油浸式三相双绕组无励磁调压配电变压器能效等级"
          },
          "evidence_quote": "",
          "quote_verified": false,
          "reason": "GB 20052-2024表1按额定容量和能效等级列出10 kV油浸式配电变压器的空载损耗与负载损耗，可按案例中的容量和产品类别定位对应限值。",
          "legacy_label": "direct_candidate",
          "discovery_method": "gold_discovery_only"
        },
        {
          "locator": {
            "standard_no": "GB 20052-2024",
            "content_type": "section",
            "page_start": 4,
            "page_end": 4,
            "text_sha256": "62c6c96ebc96f3494f7a3074d4ce09a0a8ac9e0bf4169873567be39fbceb0129",
            "section": "5.1",
            "section_title": "基本要求"
          },
          "evidence_quote": "",
          "quote_verified": false,
          "reason": "该条款仅说明技术参数应符合其他基础标准（如GB/T 1094.1等），并未提供具体的空载损耗数值或能效等级判定规则。虽然它提到了立体卷铁心变压器符合GB/T 25438，但这只是指向性引用，不能直接证明0.370kW这一具体数值的合规性，因此降级为supporting。",
          "legacy_label": "supporting_candidate",
          "discovery_method": "gold_discovery_only"
        },
        {
          "locator": {
            "standard_no": "Q/GDW 12126.4-2024",
            "content_type": "table",
            "page_start": 10,
            "page_end": 10,
            "text_sha256": "2e78c1734e20190b0b4791ae4dcaa88a599007295cbfe9580892c69e84ea4ddd",
            "table_no": "6",
            "table_title": "10 kV 三相油浸式无励磁调压电工钢闭口立体卷铁心配电变压器性能参数"
          },
          "evidence_quote": "",
          "quote_verified": false,
          "reason": "Q/GDW 12126.4-2024表6按额定容量列出S20-NX2系列的空载损耗、负载损耗、空载电流和短路阻抗，可按案例中的型号与容量定位对应参数。",
          "legacy_label": "direct_candidate",
          "discovery_method": "candidate_review"
        }
      ],
      "required_evidence_groups": [
        {
          "group_id": "complete_normative_answer",
          "requirement": "任一候选 chunk 应能独立给出该检测项目所需的完整规范性答案。",
          "alternatives": [
            {
              "locator": {
                "standard_no": "Q/GDW 12126.4-2024",
                "content_type": "table",
                "page_start": 10,
                "page_end": 10,
                "text_sha256": "2e78c1734e20190b0b4791ae4dcaa88a599007295cbfe9580892c69e84ea4ddd",
                "table_no": "6",
                "table_title": "10 kV 三相油浸式无励磁调压电工钢闭口立体卷铁心配电变压器性能参数"
              },
              "evidence_quote": "",
              "quote_verified": false,
              "reason": "Q/GDW 12126.4-2024表6按额定容量列出S20-NX2系列的空载损耗、负载损耗、空载电流和短路阻抗，可按案例中的型号与容量定位对应参数。",
              "legacy_label": "direct_candidate",
              "discovery_method": "candidate_review"
            },
            {
              "locator": {
                "standard_no": "GB 20052-2024",
                "content_type": "table",
                "page_start": 5,
                "page_end": 5,
                "text_sha256": "9c986dc1c0006eaf9bb304e9b75b58444fb63496818cb6dac2eef0b96ba572dc",
                "table_no": "1",
                "table_title": "10 kV 油浸式三相双绕组无励磁调压配电变压器能效等级"
              },
              "evidence_quote": "",
              "quote_verified": false,
              "reason": "GB 20052-2024表1按额定容量和能效等级列出10 kV油浸式配电变压器的空载损耗与负载损耗，可按案例中的容量和产品类别定位对应限值。",
              "legacy_label": "direct_candidate",
              "discovery_method": "gold_discovery_only"
            }
          ]
        }
      ],
      "deterministic_context_evidence": [],
      "review": {
        "status": "human_approved",
        "migration_basis": "Migrated from v1 direct candidates; evidence sufficiency and OR relation require domain review.",
        "flags": [
          "legacy_missing_note_resolved_by_exact_corpus_evidence",
          "candidate_recovered_by_diagnostic_search",
          "required_group_relation_verified_from_exact_corpus_evidence"
        ],
        "reviewer": "project_owner",
        "reviewed_at": "2026-07-30T08:10:57.732761+00:00",
        "decision_note": "Project-owner review confirmed."
      },
      "legacy_review_context": {
        "gold_status": "candidate_gold_recovered_pending_domain_review",
        "direct_candidate_count": 1,
        "supporting_candidate_count": 3,
        "uncertain_count": 0,
        "missing_evidence": "缺少对型号中'RL'（立体卷铁心）是否适用GB 20052-2024表1（常规叠片铁心）的明确排除或包含说明；若RL代表非晶合金，则应参考表2或其他标准，但数值0.370kW与非晶合金典型值（通常更低，如<0.2kW）不符，故推断按常规电工钢考核。",
        "review_note": "主要风险在于产品结构的精确匹配。型号S20-M.RL中的'RL'暗示立体卷铁心结构，而引用的表1针对的是常规油浸式配电变压器。虽然数值巧合地一致，但在严格审核下，需确认立体卷铁心变压器是否直接套用表1的硅钢片限值，还是另有专门规定或更严格的内部标准。因此将direct降级为uncertain，提示需进一步核实结构适用性。",
        "recovery_note": "核心证据c18正确提供了GB 20052-2024表1中400kVA、2级能效、电工钢带（对应S20系列常见材质）的空载损耗限值370W，与报告要求≤0.370kW严格匹配。其他候选项均为必要的适用范围和引用关系支持。"
      }
    },
    {
      "case_id": "hbjc-4-r2",
      "dataset_split": "development",
      "retrieval_class": "numeric_parameter_table",
      "detection_project": {
        "project_name": "空载损耗和空载电流测量",
        "reported_requirement": {
          "text": "空载电流I0(%):≤0.16(1+30%)",
          "unit": "%"
        },
        "sample_context": {
          "sample_name": "油浸式变压器",
          "model": "S20-M.RL-400/10-NX2",
          "rated_capacity": "400 kVA",
          "rated_voltage": "10/0.4 kV"
        }
      },
      "evaluation_scope": "retrieval",
      "answerability_status": "answerable_candidate",
      "missing_context_fields": [],
      "relevant_evidence": [
        {
          "locator": {
            "standard_no": "Q/GDW 12126.4-2024",
            "content_type": "table",
            "page_start": 10,
            "page_end": 10,
            "text_sha256": "2e78c1734e20190b0b4791ae4dcaa88a599007295cbfe9580892c69e84ea4ddd",
            "table_no": "6",
            "table_title": "10 kV 三相油浸式无励磁调压电工钢闭口立体卷铁心配电变压器性能参数"
          },
          "evidence_quote": "",
          "quote_verified": false,